{
  "schemaVersion": 1,
  "id": "yt-z6rvi1wifko",
  "locale": "pt",
  "basedOnVersion": 1,
  "localeVersion": 1,
  "status": "reviewed",
  "author": "EmuCore - Hub",
  "title": "A regra dos $ 150 NÃO funciona mais! - Portáteis PS2 em 2026!",
  "summary": "The Effortless Guy desafia a ideia de que US$ 150 garantem emulação PS2 utilizável em 2026, comparando o R36S, RG405V e RG557 como três etapas de preço e desempenho, em vez de uma vaga categoria de orçamento.",
  "searchKeywords": [
    "Portátil PS2 com menos de 150",
    "Comparação RG557 PS2",
    "orçamento portátil PS2 2026"
  ],
  "sourceLabels": {
    "youtube": "Assistir no YouTube"
  },
  "blocks": [
    {
      "type": "paragraph",
      "text": "A comparação de cinco minutos usa três dispositivos portáteis concretos para perguntar onde realmente começa a capacidade do PS2. R36S representa um nível mais barato orientado para Linux, RG405V é uma etapa Android mais antiga e RG557 é uma opção contemporânea mais poderosa. Colocá-los em um argumento esclarece que o preço por si só esconde a arquitetura da CPU, os drivers da GPU, a memória, o resfriamento e a disponibilidade do emulador. A conclusão do criador é menos importante do que a lacuna visível entre a tentativa de lançar o software PS2 e a manutenção de uma experiência útil em todos os jogos."
    },
    {
      "type": "paragraph",
      "text": "Todos os três links de produtos são links afiliados, e os créditos listam muitos canais externos, indicando que algumas imagens podem ser obtidas em vez de capturadas por meio de um método controlado. A descrição não fornece jogos testados, versões de emuladores, configurações, preços no dia da gravação ou comparação uniforme de cenas. Os preços de mercado também mudam rapidamente. Trate o vídeo como uma cartilha de perguntas de compra para 2026 e, em seguida, consulte os testes originais creditados e as listagens atuais. Um limite em dólares não pode substituir evidências, controles, bateria, garantia e disponibilidade regional específicos do título."
    },
    {
      "type": "youtube",
      "providerId": "Z6RVI1WiFKo"
    }
  ]
}
