{
  "schemaVersion": 1,
  "id": "yt-yyjuatqdkig",
  "locale": "fa",
  "basedOnVersion": 1,
  "localeVersion": 1,
  "status": "reviewed",
  "author": "EmuCore - Hub",
  "title": "آیا PCSX2 بهتر از سخت افزار PS2 واقعی است؟ (نسخه 2024) - Affro's Curiosities EX",
  "summary": "Affro دوازده بازی PAL PlayStation 2 را بین PCSX2 1.7.5928 با کیفیت 4K و خروجی سخت‌افزار اصلی مقایسه می‌کند و حالت ویدیوی هر عنوان را حفظ می‌کند تا بینندگان بتوانند مکان‌هایی را که بهبود و تولید مثل با هم ارزیابی می‌شوند، بررسی کنند.",
  "searchKeywords": [
    "PCSX2 در مقابل PS2 واقعی 2024",
    "مقایسه PAL PS2 4K",
    "تست خروجی سخت افزار PCSX2"
  ],
  "sourceLabels": {
    "youtube": "تماشا در YouTube"
  },
  "blocks": [
    {
      "type": "paragraph",
      "text": "این مقایسه به‌جای تکیه بر یک بازی راحت، مجموعه‌ای عمداً گسترده را پوشش می‌دهد: Gran Turismo 4، Valkyrie Profile 2، Zone of the Enders، مسابقه، مبارزه و سایر عناوین با شناسایی حالت‌های 576i، 480i یا 480p ظاهر می‌شوند. توضیحات همچنین ساخت دقیق توسعه PCSX2 را ثبت می کند و بیان می کند که هر دیسک PAL است. این محدودیت ها باعث می شود که فیلم قابل تفسیرتر باشد. بینندگان می‌توانند ثبات تصویر، مقیاس‌بندی، جلوه‌ها و سازگاری را مقایسه کنند در حالی که می‌دانند شبیه‌ساز در کنار منبع کنسول با وضوح پایین‌تر، نتیجه‌ای با کیفیت ۴K ارائه می‌دهد."
    },
    {
      "type": "paragraph",
      "text": "یک رندر شبیه ساز 4K و خروجی سخت افزار آنالوگ یا دیجیتال ضبط شده دوقلوهای خنثی نیستند. پوسته پوسته شدن، deinterlacing، سخت افزار ضبط، پردازش صفحه نمایش و رمزگذاری یوتیوب می توانند بر وضوح ظاهری غالب شوند. ساخت توسعه 2024 نیز جایگزین شده است و سازنده نسخه 2025 را پیوند می دهد. اولویت بصری را به ادعای دقت چرخه تبدیل نکنید. از ویرایش‌ها و حالت‌های نام‌گذاری شده برای شناسایی تفاوت‌های جالب استفاده کنید، سپس قبل از تشخیص رگرسیون شبیه‌سازی، یک صحنه خاص را با منطقه مشابه، ریتم فریم، رندر و زنجیره خروجی تکرار کنید."
    },
    {
      "type": "youtube",
      "providerId": "YyjUAtQdkig"
    }
  ]
}
