{
  "schemaVersion": 1,
  "id": "yt-vgmr6fhey68",
  "locale": "en",
  "basedOnVersion": 1,
  "localeVersion": 1,
  "status": "reviewed",
  "author": "EmuCore - Hub",
  "title": "How the Sony Playstation 2 Security Was Defeated | MVG",
  "summary": "Modern Vintage Gamer surveys the successive weak points and community techniques that opened the PlayStation 2, framing modchips, disc-swap approaches and memory-card exploits as a security history rather than an installation tutorial.",
  "searchKeywords": [
    "PS2 security history",
    "Free McBoot origins",
    "PlayStation 2 reverse engineering"
  ],
  "sourceLabels": {
    "youtube": "Watch on YouTube"
  },
  "blocks": [
    {
      "type": "paragraph",
      "text": "The episode asks how a closed console became accessible to hobbyists and traces multiple attack surfaces instead of attributing the result to one universal break. Its public metadata identifies modchips, the Neo Key and Messiah era, swap methods, Free McBoot, slim and original hardware, and broader PS2 security flaws. That range is useful for understanding an arms race: optical-disc trust, boot behavior and user-controlled storage each created different opportunities as the platform and its revisions evolved."
    },
    {
      "type": "paragraph",
      "text": "The video is historical context, not authorization to obtain copyrighted software, and the Hub entry should not turn its techniques into a bypass recipe. No formal threat model, affected-revision table or primary citation set accompanies every claim, so viewers should distinguish a demonstrated exploit family from a statement that every PS2 model failed identically. Its value lies in the progression of ideas and the preservation ecosystem those ideas later enabled, not in operational circumvention steps."
    },
    {
      "type": "youtube",
      "providerId": "VGMR6FHey68"
    }
  ]
}
