{
  "schemaVersion": 1,
  "id": "kessen-ps2",
  "locale": "en",
  "basedOnVersion": 1,
  "localeVersion": 1,
  "status": "reviewed",
  "author": "EmuCore - Hub",
  "title": "Kessen arrives on PlayStation 2",
  "summary": "In 2000, Kessen became a notable game release milestone in PlayStation 2 history.",
  "categoryLabels": {
    "ps2-games": "PS2 games",
    "preservation": "Preservation",
    "ps2-history": "PS2 history"
  },
  "searchKeywords": [
    "PlayStation 2",
    "PS2",
    "history",
    "timeline",
    "Kessen",
    "game release"
  ],
  "blocks": [
    {
      "type": "paragraph",
      "text": "In 2000, Kessen became a notable game release milestone in PlayStation 2 history."
    },
    {
      "type": "callout",
      "text": "In the action and adventure category, Kessen broadened the PlayStation 2 library and reflects the range of experiences available during the console's long commercial life."
    }
  ]
}
