{
  "schemaVersion": 1,
  "id": "kingdom-hearts-re-chain-of-memories-ps2",
  "locale": "de",
  "basedOnVersion": 1,
  "localeVersion": 1,
  "status": "reviewed",
  "author": "EmuCore - Hub",
  "title": "Kingdom Hearts Re:Chain of Memories erscheint für PlayStation 2",
  "summary": "2007 wurde Kingdom Hearts Re:Chain of Memories zu einem wichtigen Meilenstein der Kategorie „Spielveröffentlichung“ in der Geschichte der PlayStation 2.",
  "categoryLabels": {
    "ps2-games": "PS2-Spiele",
    "preservation": "Bewahrung",
    "ps2-history": "PS2-Geschichte"
  },
  "searchKeywords": [
    "PlayStation 2",
    "PS2",
    "Geschichte",
    "Zeitleiste",
    "Kingdom Hearts Re:Chain of Memories",
    "Spielveröffentlichung"
  ],
  "blocks": [
    {
      "type": "paragraph",
      "text": "2007 wurde Kingdom Hearts Re:Chain of Memories zu einem wichtigen Meilenstein der Kategorie „Spielveröffentlichung“ in der Geschichte der PlayStation 2."
    },
    {
      "type": "callout",
      "text": "Als Rollenspiel-Veröffentlichung erweiterte Kingdom Hearts Re:Chain of Memories die PlayStation-2-Bibliothek und zeigt die Bandbreite der Spiele während der langen Marktzeit der Konsole."
    }
  ]
}
