{
  "schemaVersion": 1,
  "id": "killzone-ps2",
  "locale": "zh",
  "basedOnVersion": 1,
  "localeVersion": 1,
  "status": "reviewed",
  "author": "EmuCore - Hub",
  "title": "Killzone 登陆 PlayStation 2",
  "summary": "Killzone在2004成为 PlayStation 2 历史中重要的“游戏发行”里程碑。",
  "categoryLabels": {
    "ps2-games": "PS2 游戏",
    "preservation": "保存",
    "ps2-history": "PS2 历史"
  },
  "searchKeywords": [
    "PlayStation 2",
    "PS2",
    "历史",
    "时间线",
    "Killzone",
    "游戏发行"
  ],
  "blocks": [
    {
      "type": "paragraph",
      "text": "Killzone在2004成为 PlayStation 2 历史中重要的“游戏发行”里程碑。"
    },
    {
      "type": "callout",
      "text": "作为一款射击作品，Killzone扩充了 PlayStation 2 的软件阵容，也体现了主机漫长商业周期中的内容广度。"
    }
  ]
}
