{
  "schemaVersion": 1,
  "id": "god-of-war-ps2",
  "locale": "id",
  "basedOnVersion": 1,
  "localeVersion": 1,
  "status": "reviewed",
  "author": "EmuCore - Hub",
  "title": "God of War hadir di PlayStation 2",
  "summary": "Pada 2005, God of War menjadi tonggak “rilis gim” penting dalam sejarah PlayStation 2.",
  "categoryLabels": {
    "ps2-games": "Gim PS2",
    "preservation": "Pelestarian",
    "ps2-history": "Sejarah PS2"
  },
  "searchKeywords": [
    "PlayStation 2",
    "PS2",
    "sejarah",
    "linimasa",
    "God of War",
    "rilis gim"
  ],
  "blocks": [
    {
      "type": "paragraph",
      "text": "Pada 2005, God of War menjadi tonggak “rilis gim” penting dalam sejarah PlayStation 2."
    },
    {
      "type": "callout",
      "text": "Sebagai rilisan aksi dan petualangan, God of War memperluas pustaka PlayStation 2 dan mencerminkan ragam pengalaman selama masa edar konsol yang panjang."
    }
  ]
}
