{
  "schemaVersion": 1,
  "id": "yt-qx6lqh0-agu",
  "locale": "cs",
  "basedOnVersion": 1,
  "localeVersion": 1,
  "status": "reviewed",
  "author": "EmuCore - Hub",
  "title": "Návod k ladění - PCSX2 | RetroAchievements (znovu nahráno)",
  "summary": "CySlaytor dokumentuje osobní pracovní postup debuggeru PCSX2 pro nalezení stabilních ukazatelů během vývoje RetroAchievements, včetně výpočtu hexadecimálního offsetu, přičemž metodu jasně odděluje od univerzálního receptu krok za krokem.",
  "searchKeywords": [
    "Návod na ladění PCSX2",
    "Hledání ukazatele RetroAchievements",
    "Offset paměti PS2"
  ],
  "sourceLabels": {
    "youtube": "Sledovat na YouTube"
  },
  "blocks": [
    {
      "type": "paragraph",
      "text": "Tento znovu nahraný výukový program je užitečný, protože zarámuje lov ukazatelů jako vyšetřovací praxi spíše než magický seznam adres. Tvůrce ukazuje přístup, který funguje v jejich vlastních relacích vytváření úspěchů, a přidává konkrétní výpočet: odečtěte hodnotu ukazatele kandidáta od cílové adresy v režimu programátoru Windows Calculator, abyste získali větší hexadecimální offset. V rámci práce RetroAchievements může tento vztah pomoci autorovi přejít z nestálého běhového umístění směrem k paměťové logice, která přežije restart nebo jiný herní stav."
    },
    {
      "type": "paragraph",
      "text": "Autor výslovně říká, že tento přístup není univerzální. Hloubka řetězce ukazatelů, revize hry, chování alokátoru a ověřování napříč resety zůstávají mimo publikovaný příklad. Číselný posun může být vnitřně konzistentní, ale přesto může po přechodu úrovní ukazovat na nesouvisející paměť. Používejte ladicí program na legálně získaném softwaru, zdokumentujte podporovaný hash, opakujte test ze studeného startu a vyhledejte peer review podle aktuálních pravidel pro vytváření RetroAchievements. Příklad učí nástroj uvažování; sama o sobě nepotvrzuje podmínku úspěchu."
    },
    {
      "type": "youtube",
      "providerId": "Qx6LQh0_agU"
    }
  ]
}
