{
  "schemaVersion": 1,
  "id": "devil-may-cry-3-ps2",
  "locale": "hi",
  "basedOnVersion": 1,
  "localeVersion": 1,
  "status": "reviewed",
  "author": "EmuCore - Hub",
  "title": "Devil May Cry 3: Dante's Awakening PlayStation 2 पर जारी",
  "summary": "Devil May Cry 3: Dante's Awakening, 2005 में PlayStation 2 के इतिहास का एक महत्वपूर्ण “गेम रिलीज़” मील का पत्थर बना।",
  "categoryLabels": {
    "ps2-games": "PS2 गेम",
    "preservation": "संरक्षण",
    "ps2-history": "PS2 इतिहास"
  },
  "searchKeywords": [
    "PlayStation 2",
    "PS2",
    "इतिहास",
    "समयरेखा",
    "Devil May Cry 3: Dante's Awakening",
    "गेम रिलीज़"
  ],
  "blocks": [
    {
      "type": "paragraph",
      "text": "Devil May Cry 3: Dante's Awakening, 2005 में PlayStation 2 के इतिहास का एक महत्वपूर्ण “गेम रिलीज़” मील का पत्थर बना।"
    },
    {
      "type": "callout",
      "text": "एक्शन और रोमांच श्रेणी की रिलीज़ के रूप में Devil May Cry 3: Dante's Awakening ने PlayStation 2 पुस्तकालय को बढ़ाया और कंसोल के लंबे व्यावसायिक जीवन की विविधता दिखाई।"
    }
  ]
}
