{
  "schemaVersion": 1,
  "id": "simpsons-hit-and-run-ps2",
  "locale": "cs",
  "basedOnVersion": 1,
  "localeVersion": 1,
  "status": "reviewed",
  "author": "EmuCore - Hub",
  "title": "The Simpsons: Hit & Run vychází pro PlayStation 2",
  "summary": "V 2003 se The Simpsons: Hit & Run stal významným milníkem typu „vydání hry“ v historii PlayStation 2.",
  "categoryLabels": {
    "ps2-games": "Hry pro PS2",
    "preservation": "Uchování",
    "ps2-history": "Historie PS2"
  },
  "searchKeywords": [
    "PlayStation 2",
    "PS2",
    "historie",
    "časová osa",
    "The Simpsons: Hit & Run",
    "vydání hry"
  ],
  "blocks": [
    {
      "type": "paragraph",
      "text": "V 2003 se The Simpsons: Hit & Run stal významným milníkem typu „vydání hry“ v historii PlayStation 2."
    },
    {
      "type": "callout",
      "text": "Jako titul žánru akce a dobrodružství rozšířil The Simpsons: Hit & Run knihovnu PlayStation 2 a ukazuje šíři nabídky během dlouhého obchodního života konzole."
    }
  ]
}
