{
  "schemaVersion": 1,
  "id": "armored-core-2-ps2",
  "locale": "cs",
  "basedOnVersion": 1,
  "localeVersion": 1,
  "status": "reviewed",
  "author": "EmuCore - Hub",
  "title": "Armored Core 2 vychází pro PlayStation 2",
  "summary": "V 2000 se Armored Core 2 stal významným milníkem typu „vydání hry“ v historii PlayStation 2.",
  "categoryLabels": {
    "ps2-games": "Hry pro PS2",
    "preservation": "Uchování",
    "ps2-history": "Historie PS2"
  },
  "searchKeywords": [
    "PlayStation 2",
    "PS2",
    "historie",
    "časová osa",
    "Armored Core 2",
    "vydání hry"
  ],
  "blocks": [
    {
      "type": "paragraph",
      "text": "V 2000 se Armored Core 2 stal významným milníkem typu „vydání hry“ v historii PlayStation 2."
    },
    {
      "type": "callout",
      "text": "Jako titul žánru akce a dobrodružství rozšířil Armored Core 2 knihovnu PlayStation 2 a ukazuje šíři nabídky během dlouhého obchodního života konzole."
    }
  ]
}
