{
  "schemaVersion": 1,
  "id": "yt-li7957gom3k",
  "locale": "fa",
  "basedOnVersion": 1,
  "localeVersion": 1,
  "status": "reviewed",
  "author": "EmuCore - Hub",
  "title": "Steam Deck: EmuDeck PS2 Emulation Guide Full (نسخه به روز شده 2024 در شرح)",
  "summary": "یک ویدیوی تایید شده از ED4T که بر شبیه سازی پلی استیشن 2 با PCSX2 در Steam Deck متمرکز شده است. به دلیل ارتباط مستقیم آن با کاتالوگ رسانه EmuCore Hub گنجانده شده است.",
  "searchKeywords": [
    "عرشه بخار",
    "راه اندازی PCSX2",
    "شبیه سازی قابل حمل",
    "پلی استیشن 2",
    "pcsx2"
  ],
  "sourceLabels": {
    "youtube": "در یوتیوب تماشا کنید"
  },
  "blocks": [
    {
      "type": "paragraph",
      "text": "ED4T این ویدئو را در 24 ژانویه 2023 منتشر کرد. عنوان تایید شده آن موضوع را به عنوان \"Steam Deck: EmuDeck PS2 Emulation Full Guide (نسخه به روز شده 2024 در شرح)\" مشخص می کند."
    },
    {
      "type": "paragraph",
      "text": "این ورودی به خوانندگان کمک می کند تا تنظیمات یا مواد عملکردی خاص دستگاه را برای سخت افزار رایانه قابل حمل پیدا کنند. ویدیوی اصلی از سوی سازنده آن در YouTube در دسترس است، در حالی که این توضیحات و رکورد کاتالوگ به صورت محلی ذخیره می‌شوند."
    },
    {
      "type": "youtube",
      "provider": "youtube",
      "providerId": "LI7957GoM3k"
    }
  ]
}
