{
  "schemaVersion": 1,
  "id": "yt-nrvqhcn15sc",
  "locale": "it",
  "basedOnVersion": 1,
  "localeVersion": 1,
  "status": "reviewed",
  "author": "EmuCore - Hub",
  "title": "Sviluppo per PlayStation 2: grafica 2D più veloce in C e benchmarking",
  "summary": "Tom Marks confronta un renderer 2D homebrew per PS2 spostando la sua implementazione critica per le prestazioni da Lua a C, preservando l'API Lua di livello superiore e testando se i confini della lingua cambiano i carichi di lavoro di esempio reali.",
  "searchKeywords": [
    "Punto di riferimento PS2SDK Lua C",
    "Modulo di rendering 2D per PS2",
    "Ottimizzazione homebrew per PlayStation 2"
  ],
  "sourceLabels": {
    "youtube": "Guarda su YouTube"
  },
  "blocks": [
    {
      "type": "paragraph",
      "text": "Questo flusso di sviluppo espone una decisione di ottimizzazione in corso anziché mostrare solo un motore finito. Il piano dichiarato mantiene l'API esistente rivolta a Lua ma trasferisce l'importante logica di disegno in C, quindi confronta i programmi di esempio per migliorarli. Questa separazione è istruttiva: un livello di scripting accessibile può rimanere parte della progettazione dello strumento mentre i cicli interni, la costruzione dei comandi o la gestione dei dati si avvicinano all'ambiente PS2SDK nativo. Il repository collegato consente agli spettatori di ispezionare il codice invece di dedurre tutto dalla schermata finale."
    },
    {
      "type": "paragraph",
      "text": "Un benchmark livestream può contenere modifiche alle build, pause di debug e rumore di misurazione; le sue note non offrono una tabella compatta di scene, flag del compilatore o statistiche di esecuzione ripetuta. Inoltre, non è possibile assegnare un’accelerazione a “C contro Lua” in astratto senza identificare quale lavoro ha oltrepassato il confine e quali allocazioni o chiamate sono scomparse. Tratta la sessione come un caso di studio di ottimizzazione trasparente. Riproduci gli stessi esempi dalla revisione collegata prima di trasferirne il risultato in un renderer o un'architettura di gioco diversa."
    },
    {
      "type": "youtube",
      "providerId": "nRVQhCN15Sc"
    }
  ]
}
