{
  "schemaVersion": 1,
  "id": "pcsx2-project-begins",
  "locale": "ar",
  "basedOnVersion": 1,
  "localeVersion": 1,
  "status": "reviewed",
  "author": "EmuCore - Hub",
  "title": "PCSX2 يدعم حفظ تراث PS2",
  "summary": "أصبح PCSX2 في 2001 محطة مهمة من نوع «محاكاة» في تاريخ PlayStation 2.",
  "categoryLabels": {
    "ps2-games": "ألعاب PS2",
    "preservation": "الحفظ",
    "ps2-history": "تاريخ PS2"
  },
  "searchKeywords": [
    "PlayStation 2",
    "PS2",
    "التاريخ",
    "الخط الزمني",
    "PCSX2",
    "محاكاة"
  ],
  "blocks": [
    {
      "type": "paragraph",
      "text": "أصبح PCSX2 في 2001 محطة مهمة من نوع «محاكاة» في تاريخ PlayStation 2."
    },
    {
      "type": "callout",
      "text": "تدعم هذه المحطة في المحاكي الحفظ طويل الأجل وبحث التوافق والوصول إلى برمجيات PS2 المملوكة قانونيًا."
    }
  ]
}
