{
  "schemaVersion": 1,
  "id": "yt-cpk1cwxrhf8",
  "locale": "it",
  "basedOnVersion": 1,
  "localeVersion": 1,
  "status": "reviewed",
  "author": "EmuCore - Hub",
  "title": "AetherSX2 vs NetherSX2: cosa c'è di veramente diverso?",
  "summary": "Un video verificato di DroidSX2 Gamer incentrato sull'emulazione, la configurazione e le prestazioni di PlayStation 2 su dispositivi Android. È incluso per la sua diretta rilevanza con il catalogo multimediale di EmuCore Hub.",
  "searchKeywords": [
    "Emulazione Android",
    "Configurazione PS2",
    "guida alle prestazioni",
    "playstation 2",
    "eterix2"
  ],
  "sourceLabels": {
    "youtube": "Guarda su YouTube"
  },
  "blocks": [
    {
      "type": "paragraph",
      "text": "DroidSX2 Gamer ha pubblicato questo video il 31 maggio 2026. Il titolo verificato identifica l'argomento come \"AetherSX2 vs NetherSX2: cosa c'è di veramente diverso?\"."
    },
    {
      "type": "paragraph",
      "text": "La voce fornisce un utile punto di riferimento per la configurazione incentrata su Android, il test dei dispositivi o i confronti degli emulatori. Il video originale rimane disponibile presso il suo creatore su YouTube, mentre la descrizione e il record del catalogo sono archiviati localmente."
    },
    {
      "type": "youtube",
      "provider": "youtube",
      "providerId": "CPK1cwxRHf8"
    }
  ]
}
