{
  "schemaVersion": 1,
  "id": "yt-roj72x142tg",
  "locale": "ru",
  "basedOnVersion": 1,
  "localeVersion": 1,
  "status": "reviewed",
  "author": "EmuCore - Hub",
  "title": "Бог войны | Сравнение PCSX2 и RPCS3 | ПС2 и ПС3",
  "summary": "Проверенное видео от N-tertainment X-tended посвящено сравнению визуального качества, точности и производительности с использованием эмуляции PlayStation 2. Он включен из-за его прямого отношения к медиа-каталогу EmuCore Hub.",
  "searchKeywords": [
    "Сравнение PS2",
    "точность эмуляции",
    "графическая производительность",
    "игровая приставка 2",
    "штx2"
  ],
  "sourceLabels": {
    "youtube": "Смотреть на YouTube"
  },
  "blocks": [
    {
      "type": "paragraph",
      "text": "Компания N-tertainment X-tended опубликовала это видео 14 июля 2022 г. В проверенном названии тема указана как «God of War | Сравнение PCSX2 и RPCS3 | PS2 и PS3»."
    },
    {
      "type": "paragraph",
      "text": "Эта запись полезна при оценке различий между исходным оборудованием, конфигурациями эмулятора, платформами или подходами к рендерингу. Исходное видео остается доступным у его создателя на YouTube, а описание и запись в каталоге сохраняются локально."
    },
    {
      "type": "youtube",
      "provider": "youtube",
      "providerId": "roJ72x142Tg"
    }
  ]
}
