{
  "schemaVersion": 1,
  "id": "yt-d4p5tx6t9wa",
  "locale": "en",
  "basedOnVersion": 1,
  "localeVersion": 1,
  "status": "reviewed",
  "author": "EmuCore - Hub",
  "title": "The Xbox Chronicles: a crazy console built to destroy the PS2 | A Xbox Documentary",
  "summary": "Sakharu Baguette tells the original Xbox story from the perspective of a newcomer built to confront PlayStation 2 dominance, covering Microsoft’s internal conflict, launch strategy, rivalry with Sony and wider impact on the console market.",
  "searchKeywords": [
    "Xbox built to challenge PS2",
    "PS2 Xbox rivalry",
    "sixth generation console history"
  ],
  "sourceLabels": {
    "youtube": "Watch on YouTube"
  },
  "blocks": [
    {
      "type": "paragraph",
      "text": "The documentary’s value to PS2 history is comparative. Six long chapters follow the computer industry context, Microsoft’s internal debate, the machine’s unusual conception, launch ambition, international difficulties and eventual retreat from its earliest expectations. Sony’s record-breaking PS2 is the external pressure that gives those decisions meaning. Looking through a competitor reveals which parts of the sixth-generation market appeared vulnerable, which strengths Microsoft tried to counter, and why a technically forceful challenger did not simply displace the established platform."
    },
    {
      "type": "paragraph",
      "text": "At more than ninety minutes, this is an authored market narrative rather than a neutral statistical comparison. The description foregrounds conflict and memorable corporate language but does not publish a bibliography, sales table or region-by-region pricing appendix. Its claim that Xbox reshaped the industry should therefore be evaluated through the specific organizational and online-service examples shown, not accepted as one indivisible conclusion. Use it to understand competitive strategy around PS2, while checking quantitative claims against primary company and market records."
    },
    {
      "type": "youtube",
      "providerId": "d4P5tx6T9wA"
    }
  ]
}
