{
  "schemaVersion": 1,
  "id": "yt-ukzsocu2daq",
  "locale": "hi",
  "basedOnVersion": 1,
  "localeVersion": 1,
  "status": "reviewed",
  "author": "EmuCore - Hub",
  "title": "स्टीम ओएस/लिनक्स पर अपना खुद का PCSX2 HD टेक्सचर पैक बनाना",
  "summary": "टी मैन ने स्टीमओएस और लिनक्स पर एक पीसीएसएक्स2 टेक्सचर-पैक वर्कफ़्लो विकसित किया है, जो प्रतिस्थापन कला को एक-क्लिक वृद्धि के रूप में प्रस्तुत करने के बजाय डंपिंग नियमों, सॉर्टिंग, एआई-अपस्केल विफलताओं और स्टीम डेक बाधाओं का दस्तावेजीकरण करता है।",
  "searchKeywords": [
    "PCSX2 टेक्सचर पैक Linux बनाएं",
    "स्टीम डेक बनावट डंपिंग",
    "PCSX2 प्रतिस्थापन संलेखन"
  ],
  "sourceLabels": {
    "youtube": "YouTube पर देखें"
  },
  "blocks": [
    {
      "type": "paragraph",
      "text": "असामान्य रूप से विस्तृत नोट्स बताते हैं कि बनावट निर्माण पुनरावृत्तीय क्यों है। प्रतिस्थापन निर्देशिका में पहले से मौजूद परिसंपत्तियाँ पुनः डंप नहीं होती हैं, और मौजूदा डंप तब तक दबा रहता है जब तक डंपिंग को टॉगल नहीं किया जाता है या गेम रीसेट नहीं हो जाता है; यह व्यवहार डुप्लिकेट कार्य को रोक सकता है लेकिन एक निर्माता को भ्रमित भी कर सकता है जो हर फ्रेम से फ़ाइलें बनाने की अपेक्षा करता है। गाइड मूल डंप को सुरक्षित रखता है क्योंकि स्वचालित अपस्केलिंग असमान रूप से सफल होती है, और यह बुडोकई 3 इंटरफ़ेस और मानचित्र तत्वों को कॉल करता है जो एक स्वच्छ पाइपलाइन का विरोध करते हैं। लिनक्स टूलींग और स्टीमओएस पैकेज बाधाओं को सीधे संबोधित किया जाता है।"
    },
    {
      "type": "paragraph",
      "text": "प्रकाशित डेक ट्यूनिंग एक अंडरवोल्टेड एलसीडी यूनिट और अप्रैल 2024-युग के सॉफ़्टवेयर स्टैक को दर्शाता है, इसलिए इसकी एसएमटी, घड़ी और जीपीयू सलाह को बिना माप के अन्य संशोधनों में कॉपी नहीं किया जाना चाहिए। एआई-संसाधित बनावट विवरण का आविष्कार कर सकती है, अल्फा को तोड़ सकती है, टाइपोग्राफी को बदल सकती है या मेमोरी बजट से अधिक हो सकती है; रचनाकारों को प्रत्येक संपत्ति की समीक्षा करनी चाहिए और स्रोत कलाकृति के अधिकारों का सम्मान करना चाहिए। अछूते डंप रखें, प्रतिस्थापन सेट का संस्करण बनाएं, गेम सीरियल रिकॉर्ड करें, और बदलावों के साथ-साथ मेनू का भी परीक्षण करें। ट्यूटोरियल एक प्रोडक्शन डायरी है, कोई सार्वभौमिक प्रदर्शन प्रीसेट नहीं।"
    },
    {
      "type": "youtube",
      "providerId": "UKZsOCU2DaQ"
    }
  ]
}
