{
  "schemaVersion": 1,
  "id": "yt-jokri8y6mxm",
  "locale": "ko",
  "basedOnVersion": 1,
  "localeVersion": 1,
  "status": "reviewed",
  "author": "EmuCore - Hub",
  "title": "PCSX2가 실제 PS2 하드웨어보다 나은가요? (2025년 후반판) - Affro의 호기심",
  "summary": "Affro의 Curiosities 공식에서 검증된 비디오는 PlayStation 2 에뮬레이션과 관련된 시각적 품질, 정확성 또는 성능 비교에 중점을 둡니다. EmuCore Hub 미디어 카탈로그와의 직접적인 관련성을 위해 포함되었습니다.",
  "searchKeywords": [
    "PS2 비교",
    "에뮬레이션 정확도",
    "그래픽 성능",
    "플레이스테이션 2",
    "개x2"
  ],
  "sourceLabels": {
    "youtube": "YouTube에서 시청하기"
  },
  "blocks": [
    {
      "type": "paragraph",
      "text": "Affro의 Curiosities 공식은 2025년 12월 17일에 이 동영상을 게시했습니다. 확인된 제목은 \"IS PCSX2가 실제 PS2 하드웨어보다 나은가요?(2025년 후반판) - Affro's Curiosities\"로 주제를 식별합니다."
    },
    {
      "type": "paragraph",
      "text": "이 항목은 원래 하드웨어, 에뮬레이터 구성, 플랫폼 또는 렌더링 접근 방식 간의 차이점을 평가할 때 유용합니다. 원본 비디오는 제작자가 YouTube에서 계속 사용할 수 있는 반면, 설명과 카탈로그 기록은 로컬에 저장됩니다."
    },
    {
      "type": "youtube",
      "provider": "youtube",
      "providerId": "JOkri8Y6MxM"
    }
  ]
}
