{
  "schemaVersion": 1,
  "id": "yt-slhqqtnngw4",
  "locale": "de",
  "basedOnVersion": 1,
  "localeVersion": 1,
  "status": "reviewed",
  "author": "EmuCore - Hub",
  "title": "Neuer NetherSX2-Emulator auf jedem Android-Telefon – Einrichtung und beste Einstellungen",
  "summary": "Ein verifiziertes Video von PRO WARRIORS, das sich auf die Emulation, Einrichtung und Leistung der PlayStation 2 auf Android-Geräten konzentriert. Es ist aufgrund seiner direkten Relevanz für den EmuCore Hub-Medienkatalog enthalten.",
  "searchKeywords": [
    "Android-Emulation",
    "PS2-Setup",
    "Leistungsleitfaden",
    "Playstation 2",
    "aethersx2"
  ],
  "sourceLabels": {
    "youtube": "Auf YouTube ansehen"
  },
  "blocks": [
    {
      "type": "paragraph",
      "text": "PRO WARRIORS hat dieses Video am 13. April 2025 veröffentlicht. Der verifizierte Titel identifiziert das Thema als „Neuer NetherSX2-Emulator auf jedem Android-Telefon – Einrichtung und beste Einstellungen“."
    },
    {
      "type": "paragraph",
      "text": "Der Eintrag bietet einen nützlichen Referenzpunkt für die Android-orientierte Einrichtung, Gerätetests oder Emulatorvergleiche. Das Originalvideo bleibt beim Ersteller auf YouTube verfügbar, während diese Beschreibung und der Katalogeintrag lokal gespeichert werden."
    },
    {
      "type": "youtube",
      "provider": "youtube",
      "providerId": "slHQqTNNGW4"
    }
  ]
}
