{
  "schemaVersion": 1,
  "id": "dark-cloud-ps2",
  "locale": "it",
  "basedOnVersion": 1,
  "localeVersion": 1,
  "status": "reviewed",
  "author": "EmuCore - Hub",
  "title": "Dark Cloud arriva su PlayStation 2",
  "summary": "Nel 2001, Dark Cloud è diventato una tappa significativa di tipo «uscita di gioco» nella storia di PlayStation 2.",
  "categoryLabels": {
    "ps2-games": "Giochi PS2",
    "preservation": "Conservazione",
    "ps2-history": "Storia di PS2"
  },
  "searchKeywords": [
    "PlayStation 2",
    "PS2",
    "storia",
    "cronologia",
    "Dark Cloud",
    "uscita di gioco"
  ],
  "blocks": [
    {
      "type": "paragraph",
      "text": "Nel 2001, Dark Cloud è diventato una tappa significativa di tipo «uscita di gioco» nella storia di PlayStation 2."
    },
    {
      "type": "callout",
      "text": "Come uscita di genere gioco di ruolo, Dark Cloud ampliò la libreria PlayStation 2 e mostra la varietà offerta durante la lunga vita commerciale della console."
    }
  ]
}
