{
  "schemaVersion": 1,
  "id": "yt-sonzzu9w4jo",
  "locale": "id",
  "basedOnVersion": 1,
  "localeVersion": 1,
  "status": "reviewed",
  "author": "EmuCore - Hub",
  "title": "New EmuCoreV PS Vita Emulator on Any Android Phone - Setup & Best Settings!",
  "summary": "Pengujian detail non-Adreno EmuCoreV pada Samsung Exynos 1480/Xclipse 530, mencakup firmware, kemasan game, driver, dan lima sampel gameplay.",
  "searchKeywords": [
    "EmuCoreV",
    "PS Vita Android",
    "PlayStation Vita emulation"
  ],
  "sourceLabels": {
    "youtube": "Tonton di YouTube"
  },
  "blocks": [
    {
      "type": "paragraph",
      "text": "RGB Tech Official mengidentifikasi ponsel kelas Galaxy M56/F56 dengan Exynos 1480, AMD Xclipse 530, dan RAM 8 GB. Video tersebut menginstal basis dan memperbarui firmware, mendemonstrasikan dua jalur impor game yang didukung, memeriksa file yang dapat dieksekusi di dalam paket yang telah disiapkan, dan kemudian menelusuri pengaturan penyaji, manajer driver, akurasi dan overlay."
    },
    {
      "type": "paragraph",
      "text": "Bab gameplay mencakup judul Uncharted: Golden Abyss, God of War, Mortal Kombat, dan Gravity Rush, memberikan konteks video yang luar biasa luas untuk perangkat driver sistem di luar jalur umum Snapdragon/Turnip. EmuCoreV secara eksplisit dijelaskan sebagai sedang dalam pengembangan, sehingga diharapkan terjadi gangguan dan perbedaan kompatibilitas; Persiapan paket juga harus dilakukan hanya dengan konten yang berhak digunakan oleh pemirsa."
    },
    {
      "type": "youtube",
      "providerId": "soNzzU9w4jo"
    }
  ]
}
