{
  "schemaVersion": 1,
  "id": "yt-efgq-kvfrti",
  "locale": "ar",
  "basedOnVersion": 1,
  "localeVersion": 1,
  "status": "reviewed",
  "author": "EmuCore - Hub",
  "title": "🔥 محاكي PS2 الجديد لنظام Android 2026 - الإعداد الكامل لمحاكي EmuCoreX، وأفضل الإعدادات واختبار اللعب",
  "summary": "مقطع فيديو تم التحقق منه من BADSHAH GAMER يركز على إعداد EmuCoreX والإعدادات واختبار اللعب على Android. تم تضمينه لارتباطه المباشر بكتالوج وسائط EmuCore Hub.",
  "searchKeywords": [
    "ايموكور",
    "محاكي أندرويد",
    "الإعداد والاختبار",
    "com.emucorex"
  ],
  "sourceLabels": {
    "youtube": "شاهد على يوتيوب"
  },
  "blocks": [
    {
      "type": "paragraph",
      "text": "نشرت BADSHAH GAMER هذا الفيديو في 27 أبريل 2026. ويحدد عنوانه الذي تم التحقق منه الموضوع بأنه \"🔥 NEW PS2 Emulator For Android 2026 - EmuCoreX Emulator Full Setup, Best الإعدادات واختبار اللعب\"."
    },
    {
      "type": "paragraph",
      "text": "يوثق الإدخال تغطية مستقلة لتطبيق EmuCore ويساعد القراء في العثور على مواد الإعداد والاختبار والمقارنة. يظل الفيديو الأصلي متاحًا من منشئه على YouTube، بينما يتم تخزين هذا الوصف وسجل الكتالوج محليًا."
    },
    {
      "type": "youtube",
      "provider": "youtube",
      "providerId": "EFgQ-kVfRtI"
    }
  ]
}
